[
  {
    "id": "population-1880",
    "year": 1880,
    "population": 24053,
    "source": {
      "title": "Wikipedia — Plovdiv (population)",
      "url": "https://en.wikipedia.org/wiki/Plovdiv",
      "accessed_at": "2026-06-19"
    }
  },
  {
    "id": "population-1887",
    "year": 1887,
    "population": 33032,
    "source": {
      "title": "Wikipedia — Plovdiv (population)",
      "url": "https://en.wikipedia.org/wiki/Plovdiv",
      "accessed_at": "2026-06-19"
    }
  },
  {
    "id": "population-1892",
    "year": 1892,
    "population": 36033,
    "source": {
      "title": "Wikipedia — Plovdiv (population)",
      "url": "https://en.wikipedia.org/wiki/Plovdiv",
      "accessed_at": "2026-06-19"
    }
  },
  {
    "id": "population-1900",
    "year": 1900,
    "population": 43033,
    "source": {
      "title": "Wikipedia — Plovdiv (population)",
      "url": "https://en.wikipedia.org/wiki/Plovdiv",
      "accessed_at": "2026-06-19"
    }
  },
  {
    "id": "population-1910",
    "year": 1910,
    "population": 47981,
    "source": {
      "title": "Wikipedia — Plovdiv (population)",
      "url": "https://en.wikipedia.org/wiki/Plovdiv",
      "accessed_at": "2026-06-19"
    }
  },
  {
    "id": "population-1920",
    "year": 1920,
    "population": 63415,
    "source": {
      "title": "Wikipedia — Plovdiv (population)",
      "url": "https://en.wikipedia.org/wiki/Plovdiv",
      "accessed_at": "2026-06-19"
    }
  },
  {
    "id": "population-1934",
    "year": 1934,
    "population": 99883,
    "source": {
      "title": "Wikipedia — Plovdiv (population)",
      "url": "https://en.wikipedia.org/wiki/Plovdiv",
      "accessed_at": "2026-06-19"
    }
  },
  {
    "id": "population-1946",
    "year": 1946,
    "population": 126563,
    "source": {
      "title": "Wikipedia — Plovdiv (population)",
      "url": "https://en.wikipedia.org/wiki/Plovdiv",
      "accessed_at": "2026-06-19"
    }
  },
  {
    "id": "population-1956",
    "year": 1956,
    "population": 161836,
    "source": {
      "title": "Wikipedia — Plovdiv (population)",
      "url": "https://en.wikipedia.org/wiki/Plovdiv",
      "accessed_at": "2026-06-19"
    }
  },
  {
    "id": "population-1965",
    "year": 1965,
    "population": 222508,
    "source": {
      "title": "Wikipedia — Plovdiv (population)",
      "url": "https://en.wikipedia.org/wiki/Plovdiv",
      "accessed_at": "2026-06-19"
    }
  },
  {
    "id": "population-1975",
    "year": 1975,
    "population": 299638,
    "source": {
      "title": "Wikipedia — Plovdiv (population)",
      "url": "https://en.wikipedia.org/wiki/Plovdiv",
      "accessed_at": "2026-06-19"
    }
  },
  {
    "id": "population-1985",
    "year": 1985,
    "population": 342131,
    "note_bg": "Връх в населението на града.",
    "note_en": "Peak population of the city.",
    "source": {
      "title": "Wikipedia — Plovdiv (population)",
      "url": "https://en.wikipedia.org/wiki/Plovdiv",
      "accessed_at": "2026-06-19"
    }
  },
  {
    "id": "population-1992",
    "year": 1992,
    "population": 341058,
    "source": {
      "title": "Wikipedia — Plovdiv (population)",
      "url": "https://en.wikipedia.org/wiki/Plovdiv",
      "accessed_at": "2026-06-19"
    }
  },
  {
    "id": "population-2001",
    "year": 2001,
    "population": 338224,
    "source": {
      "title": "Wikipedia — Plovdiv (population)",
      "url": "https://en.wikipedia.org/wiki/Plovdiv",
      "accessed_at": "2026-06-19"
    }
  },
  {
    "id": "population-2011",
    "year": 2011,
    "population": 338153,
    "source": {
      "title": "Wikipedia — Plovdiv (population)",
      "url": "https://en.wikipedia.org/wiki/Plovdiv",
      "accessed_at": "2026-06-19"
    }
  },
  {
    "id": "population-2021",
    "year": 2021,
    "population": 319612,
    "source": {
      "title": "Wikipedia — Plovdiv (population)",
      "url": "https://en.wikipedia.org/wiki/Plovdiv",
      "accessed_at": "2026-06-19"
    }
  }
]
